{
  "schema": "kel-feedback-to-pmap-apf/0.1",
  "feedback_id": "kel:feedback:q1_ilt_layout:branch_connector_east_default",
  "linked_experience_id": "kel:experience:edpr:q1_ilt_header_valve_branch_vertical_connector_001:20260913083159",
  "created_utc": "2026-09-13T08:55:39Z",
  "raw_feedback_text": "Branch connector always needs to be associated to an EA-ST. Note this in default assumption.",
  "feedback_type": "default_assumption",
  "structured_feedback": {
    "affected_requirement": "edpr:q1:pmap:requirement:branch_8in_vertical_connector",
    "affected_function": "edpr:q1:pmap:function:provide_branch_connection",
    "affected_behavior": "edpr:q1:pmap:behaviour:branch_strain",
    "affected_structure": "edpr:q1:pmap:artifact:branch_pipe",
    "affected_constraint": null,
    "pmap_issue": "Branch connector always needs to be associated to an EA-ST. Note this in default assumption.",
    "apf_action": "add_default_design_assumption_for_expert_review_and_reuse",
    "priority": "high"
  }
}
