{
  "schema": "kel-feedback-to-pmap-apf/0.1",
  "feedback_id": "kel:feedback:q1_ilt_layout:east_parameters_connections",
  "linked_experience_id": "kel:experience:edpr:q1_ilt_header_valve_branch_vertical_connector_001:20260913083159",
  "created_utc": "2026-09-13T09:08:09Z",
  "raw_feedback_text": "EA-ST is not as per EDES or EDAS. Future plots must show EA-ST parameters, active connectors, association to branch top or side feature, and pipe connection points.",
  "feedback_type": "poor_plot",
  "structured_feedback": {
    "affected_requirement": "edpr:q1:pmap:requirement:branch_8in_vertical_connector",
    "affected_function": "edpr:q1:pmap:function:provide_branch_connection",
    "affected_behavior": "edpr:q1:pmap:behaviour:header_strain",
    "affected_structure": "edpr:q1:pmap:artifact:branch_pipe",
    "affected_constraint": null,
    "pmap_issue": "EA-ST is not as per EDES or EDAS. Future plots must show EA-ST parameters, active connectors, association to branch top or side feature, and pipe connection points.",
    "apf_action": "review_plotter_output_and_add_plot_validation_rule",
    "priority": "medium"
  }
}
